{
  "key": "fusion-weight",
  "title": "Hybrid fusion weight sweep",
  "question": "Does a learned fusion weight beat the fixed 0.5 weight?",
  "intervention": "Learn the fusion weight on the dev split.",
  "acceptance": {
    "selection_splits": [
      "dev"
    ],
    "confirmation_splits": [
      "fresh-held-out"
    ],
    "primary_metric": "ndcg_at_10",
    "required_slices": [],
    "success_criteria": "Primary gate passes.",
    "falsification_criteria": "Primary gate fails.",
    "regression_gates": [],
    "compute_budget": {
      "cpu_hours_max": 2
    }
  }
}
